<?xml version="1.0" encoding="utf-8"?>
<!DOCTYPE I2CEConfiguration SYSTEM "I2CE_Configuration.dtd">
<I2CEConfiguration name="SelfService" path="/">
  <metadata>
    <version>4.2.1.0.1</version>
  </metadata>
  <configurationGroup name="SelfService" path="/" locale="uk">
    <version>4.2.0.1.1</version>
    <configurationGroup name="SS" path="/modules/SelfService">
      <configurationGroup name="page">
        <configurationGroup name="view">
          <configurationGroup name="args">
            <configuration name="title" locale="uk">
              <value>Перегляд</value>
            </configuration>
          </configurationGroup>
        </configurationGroup>
      </configurationGroup>
    </configurationGroup>
    <configurationGroup name="tasks" path="/I2CE/tasks/task_description" locale="uk">
      <configuration name="person_can_view_child_form_user_map" locale="uk"></configuration>
      <configuration name="person_can_edit_child_form_user_map" locale="uk"></configuration>
    </configurationGroup>
    <configurationGroup name="forms" path="/modules/forms">
      <configurationGroup name="forms">
        <configurationGroup name="user_map">
          <configuration name="display" values="single" locale="uk">
            <value>Карта користувача</value>
          </configuration>
        </configurationGroup>
      </configurationGroup>
      <configurationGroup name="formClasses">
        <configurationGroup name="iHRIS_UserMap">
          <configurationGroup name="fields">
            <configurationGroup name="username">
              <configuration name="headers" type="delimited" locale="uk">
                <value>default:Ім'я користувача</value>
              </configuration>
            </configurationGroup>
          </configurationGroup>
        </configurationGroup>
      </configurationGroup>
    </configurationGroup>
    <configurationGroup name="page" path="/modules/SelfService/page">
      <configurationGroup name="userAccount">
        <configurationGroup name="args">
          <configuration name="title" values="single" locale="uk">
            <value>Додати/оновити обліковий запис користувача</value>
          </configuration>
        </configurationGroup>
      </configurationGroup>
    </configurationGroup>
  </configurationGroup>
</I2CEConfiguration>