<?xml version="1.0" encoding="utf-8"?>
<!DOCTYPE I2CEConfiguration SYSTEM "I2CE_Configuration.dtd">
<I2CEConfiguration name="Photo" path="/I2CE">
  <metadata>
    <version>4.3.0.1</version>
  </metadata>
  <configurationGroup name="Photo" path="/I2CE" locale="sw">
    <version>4.3.0.1</version>
    <configurationGroup name="forms" path="/modules/forms">
      <configurationGroup name="formClasses">
        <configurationGroup name="iHRIS_Photo">
          <configurationGroup name="fields">
            <configurationGroup name="image">
              <configuration name="headers" type="delimited" locale="sw">
                <value>default:Taswira</value>
              </configuration>
            </configurationGroup>
            <configurationGroup name="date">
              <configuration name="headers" type="delimited" locale="sw">
                <value>default:Tarehe</value>
              </configuration>
            </configurationGroup>
            <configurationGroup name="description">
              <configuration name="headers" type="delimited" values="many" locale="sw">
                <value>default:Ufafanuzi</value>
              </configuration>
            </configurationGroup>
          </configurationGroup>
        </configurationGroup>
      </configurationGroup>
    </configurationGroup>
  </configurationGroup>
</I2CEConfiguration>