<?xml version="1.0" encoding="utf-8"?>
<!DOCTYPE I2CEConfiguration SYSTEM "I2CE_Configuration.dtd">
<I2CEConfiguration name="PersonEmployment" path="/I2CE">
  <metadata>
    <version>4.2.1.0.1</version>
  </metadata>
  <configurationGroup name="PersonEmployment" path="/I2CE" locale="br">
    <version>4.2.0.1</version>
    <configurationGroup name="tasks" path="/I2CE/tasks/task_description" locale="br">
      <configuration name="person_can_view_child_form_employment" locale="br">
        <value>A c'hall diskwel furmskrid bugel chemet micherel un den</value>
      </configuration>
      <configuration name="person_can_edit_child_form_employment" locale="br">
        <value>A c'hall kemmañ furmskridoù bugel chemet un den</value>
      </configuration>
    </configurationGroup>
    <configurationGroup name="page">
      <configurationGroup name="employment">
        <configurationGroup name="args">
          <configuration name="title" values="single" locale="br">
            <value>Ouzhpennañ/hizivaat ar chemet micherel</value>
          </configuration>
        </configurationGroup>
      </configurationGroup>
    </configurationGroup>
    <configurationGroup name="forms" path="/modules/forms">
      <configurationGroup name="forms">
        <configurationGroup name="employment">
          <configuration name="display" values="single" locale="br">
            <value>Chemet micherel</value>
          </configuration>
        </configurationGroup>
      </configurationGroup>
      <configurationGroup name="formClasses">
        <configurationGroup name="iHRIS_Employment">
          <configurationGroup name="fields">
            <configurationGroup name="company_name">
              <configuration name="headers" type="delimited" locale="br">
                <value>default:Anv ar c'hevredad</value>
              </configuration>
            </configurationGroup>
            <configurationGroup name="company_address">
              <configuration name="headers" type="delimited" locale="br">
                <value>default:Chomlec'h ar c'hevredad</value>
              </configuration>
            </configurationGroup>
            <configurationGroup name="company_phone">
              <configuration name="headers" type="delimited" locale="br">
                <value>default:Pellgomz ar c'henvredad</value>
              </configuration>
            </configurationGroup>
            <configurationGroup name="start_date">
              <configuration name="headers" type="delimited" locale="br">
                <value>default:Deiziad kregiñ</value>
              </configuration>
            </configurationGroup>
            <configurationGroup name="start_wage">
              <configuration name="headers" type="delimited" locale="br">
                <value>default:Gopr deroù</value>
              </configuration>
            </configurationGroup>
            <configurationGroup name="start_position">
              <configuration name="headers" type="delimited" locale="br">
                <value>default:Post deroù</value>
              </configuration>
            </configurationGroup>
            <configurationGroup name="end_date">
              <configuration name="headers" type="delimited" locale="br">
                <value>default:Deiziad dibenn (chom hep kargañ ma vez implijet c'hoazh)</value>
              </configuration>
            </configurationGroup>
            <configurationGroup name="end_wage">
              <configuration name="headers" type="delimited" locale="br">
                <value>default:Gopr diwezhañ</value>
              </configuration>
            </configurationGroup>
            <configurationGroup name="end_position">
              <configuration name="headers" type="delimited" locale="br">
                <value>default:Post diwezhañ</value>
              </configuration>
            </configurationGroup>
            <configurationGroup name="supervisor">
              <configuration name="headers" type="delimited" locale="br">
                <value>default:Gourseller</value>
              </configuration>
            </configurationGroup>
            <configurationGroup name="contact_ok">
              <configuration name="headers" type="delimited" locale="br">
                <value>default:Ha gallout a reer mont e darempred gantañ?</value>
              </configuration>
            </configurationGroup>
            <configurationGroup name="responsibilities">
              <configuration name="headers" type="delimited" locale="br">
                <value>default:Atebegezhioù stag ouzh ar post</value>
              </configuration>
            </configurationGroup>
            <configurationGroup name="reason_for_leaving">
              <configuration name="headers" type="delimited" locale="br">
                <value>default:Abegoù an disparti</value>
              </configuration>
            </configurationGroup>
          </configurationGroup>
        </configurationGroup>
      </configurationGroup>
    </configurationGroup>
  </configurationGroup>
</I2CEConfiguration>