<?xml version="1.0" encoding="utf-8"?>
<!DOCTYPE I2CEConfiguration SYSTEM "I2CE_Configuration.dtd">
<I2CEConfiguration name="InfoManStorate_FacilityMap" path="/">
  <metadata>
    <version>4.3.0</version>
  </metadata>
  <configurationGroup name="InfoManStorate_FacilityMap" path="/" locale="en_US">
    <version>4.3.0</version>
    <configurationGroup name="csd_faciliy_field" path="/modules/forms/formClasses/iHRIS_Facility/fields/csd_facility">
      <configuration name="headers" type="delimited" locale="en_US">
        <value>default:CSD Facility</value>
      </configuration>
    </configurationGroup>
  </configurationGroup>
</I2CEConfiguration>