<?xml version="1.0" encoding="utf-8"?>
<!DOCTYPE I2CEConfiguration SYSTEM "I2CE_Configuration.dtd">
<I2CEConfiguration name="PersonID" path="/I2CE">
  <metadata>
    <version>4.2.1.0.1</version>
  </metadata>
  <configurationGroup name="PersonID" path="/I2CE" locale="br">
    <version>4.2.1.0.1</version>
    <configurationGroup name="invalid_formfield_message" path="/modules/forms/formfield_messages" locale="br">
      <configuration name="exp_date" path="person_id/expiration_date/bad_date" locale="br">
        <value>An deiziad termen a zle bezañ goude an deiziad embann</value>
      </configuration>
      <configuration name="wrong_pattern" path="person_id/id_num/wrong_pattern" locale="br"></configuration>
    </configurationGroup>
    <configurationGroup name="tasks" path="/I2CE/tasks/task_description" locale="br">
      <configuration name="person_can_view_child_form_person_id" locale="br">
        <value>A c'hall diskwel furmskrid bugel ID un den</value>
      </configuration>
      <configuration name="person_can_edit_child_form_person_id" locale="br">
        <value>A c'hall kemmañ furmskridoù bugel ID un den</value>
      </configuration>
      <configuration name="can_edit_database_list_id_type" locale="br">
        <value>A c'hall kemmañ roll diaz titouroù ar seurtoù ID</value>
      </configuration>
      <configuration name="can_view_database_list_id_type" locale="br">
        <value>A c'hall diskwel roll diaz titouroù ar seurtoù ID</value>
      </configuration>
    </configurationGroup>
    <configurationGroup name="page">
      <configurationGroup name="person_id">
        <configurationGroup name="args">
          <configuration name="title" values="single" locale="br">
            <value>Ouzhpennañ/Hizivaat anaout</value>
          </configuration>
        </configurationGroup>
      </configurationGroup>
    </configurationGroup>
    <configurationGroup name="forms" path="/modules/forms/forms">
      <configurationGroup name="id_type">
        <configuration name="display" values="single" locale="br">
          <value>Doare anaout</value>
        </configuration>
      </configurationGroup>
      <configurationGroup name="person_id">
        <configuration name="display" values="single" locale="br">
          <value>anaout an den</value>
        </configuration>
        <configurationGroup name="meta">
          <configuration name="description" locale="br">
            <value>Titouroù diazez war un anaoudadur evit un den zo er furmskrid-mañ</value>
          </configuration>
        </configurationGroup>
      </configurationGroup>
    </configurationGroup>
    <configurationGroup name="forms" path="/modules/forms/formClasses">
      <configurationGroup name="iHRIS_PersonID">
        <configurationGroup name="fields">
          <configurationGroup name="id_type">
            <configuration name="headers" type="delimited" locale="br">
              <value>default:Doare anaout</value>
            </configuration>
          </configurationGroup>
          <configurationGroup name="id_num">
            <configuration name="headers" type="delimited" locale="br">
              <value>default:Niverenn-anaout</value>
            </configuration>
          </configurationGroup>
          <configurationGroup name="issue_date">
            <configuration name="headers" type="delimited" locale="br">
              <value>default:Deiziad embann</value>
            </configuration>
          </configurationGroup>
          <configurationGroup name="expiration_date">
            <configuration name="headers" type="delimited" locale="br">
              <value>default:Deiziad termen</value>
            </configuration>
          </configurationGroup>
          <configurationGroup name="country">
            <configuration name="headers" type="delimited" locale="br">
              <value>default:Bro embann</value>
            </configuration>
          </configurationGroup>
          <configurationGroup name="place">
            <configuration name="headers" type="delimited" locale="br">
              <value>default:Lec'h embann</value>
            </configuration>
          </configurationGroup>
        </configurationGroup>
      </configurationGroup>
      <configurationGroup name="iHRIS_PersonID_Type">
        <configurationGroup name="fields">
          <configurationGroup name="pattern">
            <configuration name="headers" type="delimited" locale="br"></configuration>
          </configurationGroup>
        </configurationGroup>
      </configurationGroup>
    </configurationGroup>
  </configurationGroup>
</I2CEConfiguration>