<?xml version="1.0"?>
<!DOCTYPE I2CEConfiguration SYSTEM "I2CE_Configuration.dtd">
<I2CEConfiguration name="localeSelector">
  <metadata>
    <displayName>Locale Selector</displayName>
    <className>I2CE_Module_LocaleSelector</className>
    <version>4.3.0</version>
  </metadata>
  <configurationGroup name="localeSelector" locale="zh_CN">
    <configuration name="languages" path="/locales/languages" values="many" type="delimited">
      <version>4.0.0</version>
      <value>aa:阿法尔语</value>
      <value>ab:阿布哈西亚语</value>
      <value>ae:阿维斯陀语</value>
      <value>af:南非荷兰语</value>
      <value>am:阿姆哈拉语</value>
      <value>ar:阿拉伯语</value>
      <value>as:阿萨姆语</value>
      <value>ay:艾马拉语</value>
      <value>az:阿塞拜疆语</value>
      <value>ba:巴什基尔语</value>
      <value>be:白俄罗斯语</value>
      <value>bg:保加利亚语</value>
      <value>bh:比哈里语</value>
      <value>bi:比斯拉马语</value>
      <value>bn:孟加拉语</value>
      <value>bo:藏语</value>
      <value>br:布里多尼语</value>
      <value>bs:波斯尼亚语</value>
      <value>ca:加泰罗尼亚语</value>
      <value>ce:车臣语</value>
      <value>ch:查莫罗语</value>
      <value>co:科西嘉语</value>
      <value>cs:捷克语</value>
      <value>cu:宗教斯拉夫语(古代俄语)</value>
      <value>cv:楚瓦什语</value>
      <value>cy:威尔士</value>
      <value>da:丹麦语</value>
      <value>de:德语</value>
      <value>dz:不丹宗卡语</value>
      <value>el:希腊语</value>
      <value>en:英语</value>
      <value>en_GB:英国英语</value>
      <value>en_US:美国英语</value>
      <value>eo:世界语</value>
      <value>es:西班牙语</value>
      <value>et:爱沙尼亚语</value>
      <value>eu:巴斯克语</value>
      <value>fa:波斯语</value>
      <value>fi:芬兰语</value>
      <value>fj:斐济语</value>
      <value>fo:法罗群岛语</value>
      <value>fr:法语</value>
      <value>fy:弗里斯兰语</value>
      <value>ga:爱尔兰盖尔语</value>
      <value>gd:盖尔语</value>
      <value>gl:加利西亚语</value>
      <value>gn:瓜拉尼语</value>
      <value>gu:古吉拉特语</value>
      <value>gv:马恩岛语</value>
      <value>ha:豪撒语</value>
      <value>he:希伯来语</value>
      <value>hi:北印度语</value>
      <value>ho:新里木托语</value>
      <value>hr:克罗地亚语</value>
      <value>hsb:索布语</value>
      <value>hu:匈牙利语</value>
      <value>hy:亚美尼亚语</value>
      <value>hz:赫雷罗语</value>
      <value>ia:拉丁国际语(国际辅助语)</value>
      <value>id:印度尼西亚语</value>
      <value>ie:语际语</value>
      <value>ik:因纽佩特语</value>
      <value>io:伊多语</value>
      <value>is:冰岛语</value>
      <value>it:意大利语</value>
      <value>iu:因纽特语</value>
      <value>ja:日语</value>
      <value>jv:爪哇语</value>
      <value>ka:乔治亚语</value>
      <value>ki:基库尤语</value>
      <value>kk:哈萨克语</value>
      <value>kl:格陵兰语</value>
      <value>km:高棉语</value>
      <value>kn:坎纳德语</value>
      <value>ko:朝鲜语</value>
      <value>ks:克什米尔语</value>
      <value>ku:库尔德语</value>
      <value>kv:科米语</value>
      <value>kw:康瓦尔郡语</value>
      <value>ky:吉尔吉斯语</value>
      <value>la:拉丁语</value>
      <value>lb:卢森堡语</value>
      <value>li:林堡语</value>
      <value>ln:林加拉语</value>
      <value>lo:老挝语</value>
      <value>lt:立陶宛语</value>
      <value>lv:拉脱维亚语</value>
      <value>mg:马尔加什语</value>
      <value>mh:马绍尔语</value>
      <value>mi:毛利语</value>
      <value>mk:马其顿语</value>
      <value>ml:德拉维族语</value>
      <value>mn:蒙古语</value>
      <value>mo:摩尔多瓦</value>
      <value>mr:马拉地语</value>
      <value>ms:马来西亚语</value>
      <value>mt:马耳他语</value>
      <value>my:缅甸语</value>
      <value>na:瑙鲁语</value>
      <value>nb:挪威语 (博克马尔语)</value>
      <value>nd:Ndebele，北部</value>
      <value>nds:撒克逊语</value>
      <value>ne:尼泊尔语</value>
      <value>nl:荷兰语</value>
      <value>nn:挪威语 (尼诺斯克语)</value>
      <value>nr:Ndebele，南部</value>
      <value>nso:北部梭托语</value>
      <value>nv:纳瓦霍语</value>
      <value>ny:齐切瓦语</value>
      <value>oc:奥西坦语</value>
      <value>om:阿曼语</value>
      <value>or:欧里亚语</value>
      <value>os:奥塞梯语</value>
      <value>pa:旁遮普语</value>
      <value>pi:巴利语</value>
      <value>pl:波兰语</value>
      <value>ps:普什图语</value>
      <value>pt:葡萄牙语</value>
      <value>pt_BR:巴西葡萄牙语</value>
      <value>qu:盖丘亚语</value>
      <value>rn:基隆迪语</value>
      <value>ro:罗马尼亚语</value>
      <value>rom:吉普赛语</value>
      <value>ru:俄语</value>
      <value>rw:卢旺达语</value>
      <value>sa:梵语</value>
      <value>sc:撒丁语</value>
      <value>se:北部沙米语</value>
      <value>sg:桑戈语</value>
      <value>si:僧伽罗语</value>
      <value>sk:斯洛伐克语</value>
      <value>sl:斯洛文尼亚语</value>
      <value>sm:萨摩亚语</value>
      <value>sn:修纳语</value>
      <value>so:索马里语</value>
      <value>sq:阿尔巴尼亚语</value>
      <value>sr:塞尔维亚语(拉丁)</value>
      <value>ss:斯瓦特语</value>
      <value>st:索托，南部</value>
      <value>su:巽他语</value>
      <value>sv:瑞典语</value>
      <value>sw:斯瓦希里语</value>
      <value>ta:泰米尔语</value>
      <value>te:泰卢固语</value>
      <value>tg:塔吉克语</value>
      <value>th:泰语</value>
      <value>ti:提格里尼亚语</value>
      <value>tk:土库曼语</value>
      <value>tn:茨瓦纳语</value>
      <value>to:汤加语</value>
      <value>tr:土耳其语</value>
      <value>ts:特松加语</value>
      <value>tt:鞑靼语</value>
      <value>tw:契维语</value>
      <value>ty:塔希提语</value>
      <value>ug:维吾尔语</value>
      <value>uk:乌克兰语</value>
      <value>ur:乌尔都语</value>
      <value>uz:乌兹别克语</value>
      <value>ven:闻达语</value>
      <value>vi:越南语</value>
      <value>vo:沃拉普克语</value>
      <value>wa:瓦龙语</value>
      <value>wo:沃洛夫语</value>
      <value>xh:科萨语</value>
      <value>yi:依地语</value>
      <value>yo:约鲁巴语</value>
      <value>za:壮语</value>
      <value>zh:中文</value>
      <value>zh_CN:简体中文</value>
      <value>zh_HK:繁体中文(香港)</value>
      <value>zh_TW:繁体中文</value>
      <value>zu:祖鲁语</value>
    </configuration>
  </configurationGroup>
</I2CEConfiguration>