<?xml version="1.0" encoding="utf-8"?>
<!DOCTYPE I2CEConfiguration SYSTEM "I2CE_Configuration.dtd">
<I2CEConfiguration name="SampleData-currency" path="//I2CE/formsData/forms/currency">
  <metadata>
    <version>4.2.1.0.1</version>
  </metadata>
  <configurationGroup name="SampleData-currency" path="//I2CE/formsData/forms/currency" locale="fr_ML">
    <version>4.2.0.1</version>
    <configurationGroup name="2">
      <configurationGroup name="fields">
        <configuration name="name" locale="fr_ML"></configuration>
      </configurationGroup>
    </configurationGroup>
    <configurationGroup name="3">
      <configurationGroup name="fields">
        <configuration name="name" locale="fr_ML">
          <value>Dollar Americain</value>
        </configuration>
      </configurationGroup>
    </configurationGroup>
    <configurationGroup name="4">
      <configurationGroup name="fields">
        <configuration name="name" locale="fr_ML">
          <value>Livre Sterling</value>
        </configuration>
      </configurationGroup>
    </configurationGroup>
  </configurationGroup>
</I2CEConfiguration>