<?xml version="1.0" encoding="utf-8"?>
<!DOCTYPE I2CEConfiguration SYSTEM "I2CE_Configuration.dtd">
<I2CEConfiguration name="who_cadre" path="/">
  <metadata>
    <version>4.3.0.1</version>
  </metadata>
  <configurationGroup name="who_cadre" path="/" locale="pt_BR">
    <version>4.3.0.1</version>
    <configurationGroup name="who_cadre_form" path="/modules/forms/forms/who_cadre">
      <configuration name="display" locale="pt_BR">
        <value>Cadre (OMS)</value>
      </configuration>
    </configurationGroup>
  </configurationGroup>
</I2CEConfiguration>